"title","channel_title","category_id","category_desc","views","likes","dislikes","comment_total","day","month"
"Jacob Sartorius - Hang Me Out To Dry","Jacob Sartorius",10,"Music",195467,24976,690,3032,1,1
"Chemotherapy Effects Not Working!","Wil Dasovich",22,"People & Blogs",347690,14268,134,2207,1,1
"James Blunt - Don't Give Me Those Eyes [Official Video]","James Blunt",10,"Music",158231,7729,87,379,1,1
"Why Farming Is Broken (And Always Has Been)","MinuteEarth",28,"Science & Technology",353003,14022,806,1373,1,1
"Jon Cozart Roasts Lilly Singh, Liza Koshy & Casey Neistat with a Song - Streamys 2017","Streamy Awards",24,"Entertainment",1709727,83454,1402,3761,1,1
"Luis Fonsi - Despacito (Beatbox Cover) | Hiss & Bigman | Shout out","Korea Beatbox TV",10,"Music",752529,19597,556,1405,1,1
"GET UNREADY WITH ME!","AndreasChoice",26,"Howto & Style",213200,12514,252,393,1,1
"Dramatic Vampy Fall Makeup Tutorial","Christen Dominique",26,"Howto & Style",236491,20055,198,1444,1,1
"HUSBAND + FATHER STRUGGLES || #MOMTEMBER","From Head To Toe",26,"Howto & Style",67098,3813,40,272,1,1
"Stranger Things | Love in the Upside Down | Netflix","Netflix",24,"Entertainment",357333,12090,221,779,1,1
"I Spent 24 Hours in Complete Darkness & Silence and It Sent Me Crazy (No Senses Challenge)","Kill'em",24,"Entertainment",423539,16250,1435,4264,1,1
"i'm not okay.","The Gabbie Show",26,"Howto & Style",2072750,167165,3254,15065,1,1
"Queen Sugar Star Kofi Siriboe!","Wendy Williams",24,"Entertainment",197336,4055,117,944,1,1
"Reese Witherspoon Passionately Speaks About Roles for Women | Lorraine","Lorraine",24,"Entertainment",9980,34,1,0,1,1
"GOTTI (2017 Movie) – Official Trailer – John Travolta","Lionsgate Movies",1,"Film & Animation",851604,4484,523,1432,1,1
"76ers' Ben Simmons: Donald Trump is an 'idiot,' 'd***head'","NBA Highlights · YouTube",17,"Sports",20969,62,34,105,1,1
"iPhone 8 Plus vs. Galaxy Note 8 Speed Test","PhoneBuff",28,"Science & Technology",408297,8754,914,3529,1,1
"Playboy founder Hugh Hefner dies at 91","CNN",25,"News & Politics",17800,147,71,271,1,1
"We Tried 3 Iconic Kim Kardashian Looks KUWTK 10 Year Anniversary | Beauty Evolution | Refinery29","Refinery29",26,"Howto & Style",27748,365,32,34,1,1
"50 Cent Confronts Ebro + Keeps It Real On ‘4:44’, Trump & Mayweather","HOT 97",10,"Music",746405,7838,433,1844,1,1
"Petit Biscuit - Waterfall Ft. Panama (Official Audio)","Petit Biscuit",10,"Music",100524,5768,56,323,1,1
"Nikki​ and​ Artem’s - Samba - Dancing with the Stars","Dancing With The Stars",24,"Entertainment",308198,3732,143,445,1,1
"LEAVING YOUTUBE... chit chat get ready with me","James Charles",24,"Entertainment",704354,30330,2852,2832,1,1
"Pennywise IT Halloween Costume & Makeup Tutorial","Jordan Hanz",26,"Howto & Style",74054,6872,38,556,1,1
"Hack It Like a Chef - The Effortless Midweek Meal","SORTEDfood",26,"Howto & Style",105917,3595,48,218,1,1
"Audi Think Faster: Episode 2 Featuring Elizabeth Banks","Audi USA",2,"Cars & Vehicles",37915,192,44,42,1,1
"Lindsey Vonn | UNLIKE ANY","Under Armour",17,"Sports",259243,84,15,9,1,1
"Jared Leto says he never gifted used condoms | SiriusXM | Entertainment Weekly Radio","SiriusXM",10,"Music",24703,402,4,54,1,1
"Honest Trailers - Star Trek: The Next Generation","Screen Junkies",1,"Film & Animation",1956813,49656,1287,6894,1,1
"Hansen Unplugged: Anthem protests not about disrespecting the flag","WFAA",25,"News & Politics",768040,18795,2062,2487,1,1
"Darkest Hour - Official International Trailer (Universal Pictures) HD","Universal Pictures UK",24,"Entertainment",443500,361,11,91,1,1
"The Hidden Detail You Missed about Stranger Things’ Shadow Monster! (Nerdist News w/ Jessica Chobot)","Nerdist",24,"Entertainment",53340,1700,33,94,1,1
"Terror Jr - Fight And Fuck","Terror Jr",10,"Music",13671,921,8,71,1,1
"Grateful (Official Lyric Video) - Elevation Worship","Elevation Worship",10,"Music",32572,1447,19,0,1,1
"Date Meal  [pasta] - You Suck at Cooking (episode 66)","You Suck At Cooking",26,"Howto & Style",613640,25595,350,1968,1,1
"September FAVOURITES | Fleur De Force","Fleur DeForce",26,"Howto & Style",98036,3029,69,153,1,1
"Man Feeds WILD SNAKE Friend A Snack | The Dodo","The Dodo",15,"Pets & Animals",314551,9745,188,974,1,1
"Eating The WHOLE Animal! NINE Course NOSE to TAIL Feast in Singapore","Strictly Dumpling",19,"Travel & Events",265279,7939,182,741,1,1
"Dating the IT Clown | Hannah Stocking","Hannah Stocking",23,"Comedy",3619723,127552,4725,5506,1,1
"Katy Perry: Will You Be My Witness? - Official Trailer","Katy Perry",24,"Entertainment",131589,9512,261,605,1,1
"Is It Art? The Rise of Made-for-Instagram Exhibits | WIRED","WIRED",28,"Science & Technology",17248,667,143,141,1,1
"The Voice 2017 Blind Audition - Dave Crosby: I Will Follow You into the Dark","The Voice",24,"Entertainment",2732335,37996,1039,1674,1,1
"Grey - Wings Clipped (ft. Avril Lavigne & Anthony Green) (Official Audio)","Grey",10,"Music",28770,1763,15,248,1,1
"Camila Cabello - Havana Acoustic | Elvis Duran Live","Elvis Duran Show",24,"Entertainment",469549,34958,316,1694,1,1
"Clash of Clans - Builder Hall 7 UPDATE!","Clash of Clans",20,"Gaming",1953823,45960,2708,2048,1,1
"Sam Smith - Too Good At Goodbyes (Galantis Remix)","Galantis",10,"Music",116912,7495,205,437,1,1
"The Chaos President Cold Open - SNL","Saturday Night Live",24,"Entertainment",4133628,40667,8129,8455,2,1
"Poppin Bottles w/ Instagram Models","sWooZie",24,"Entertainment",905808,52993,1195,4551,2,1
"O.J. Simpson Freed From Prison After 9 Years","Inside Edition",25,"News & Politics",201754,2905,592,1751,2,1
"Unboxing The Mind Bending Wallpaper TV...","Unbox Therapy",28,"Science & Technology",1883596,59722,1968,7593,2,1
"Game Theory: The Pokedex is FULL OF LIES! (Pokemon)","The Game Theorists",20,"Gaming",1544314,59195,4309,29024,2,1
"250,000 DOMINOES! - The American Domino Record - Smarter Every Day 178","SmarterEveryDay",28,"Science & Technology",802983,25037,976,5252,2,1
"Pittsburgh Steelers Vs Baltimore Ravens National Anthem 10/1/17","Random Ryan",23,"Comedy",100378,565,1131,971,2,1
"BOUGHT MY PARENTS A MANSION! *emotional*","Wassabi Productions",24,"Entertainment",1141430,101981,1157,18682,2,1
"HOT DOG INSIDE A BURGER - VERSUS","HellthyJunkFood",24,"Entertainment",639212,14084,1223,3574,2,1
"Eat, Clay, Love | Original Short Film","Julien Solomita",24,"Entertainment",217574,40553,521,4671,2,1
"THE MICROWAVE CHRONICLES | Microwave Moments on Kitchen Nightmares","Kitchen Nightmares",24,"Entertainment",710868,10968,205,2035,2,1
"Schlieren Imaging in Color!","Veritasium",27,"Education",472072,24247,234,1980,2,1
"Moments after Raw went off the air - WWE Top 10","WWE",17,"Sports",2083525,36482,1677,2788,2,1
"Film Theory: Pickle Rick ACTUALLY WORKS! (Rick and Morty, Feat. DAN HARMON!)","The Film Theorists",1,"Film & Animation",3222303,122462,12650,18060,2,1
"The best photos taken through a microscope","Quartz",25,"News & Politics",43589,974,18,54,2,1
"Every Tinder Ever","Sam O'Nella Vlog",22,"People & Blogs",943802,16870,783,1152,2,1
"How to be Gangster 2.0","nigahiga",24,"Entertainment",3319745,196656,3091,19958,2,1
"The perfect thing for a hangover!","JennThe Mermaid",23,"Comedy",369619,1878,3882,0,2,1
"When your kid annoys you part 4","Jamie Baker",22,"People & Blogs",438822,8495,477,730,2,1
"The Shark Tier List","TierZoo",20,"Gaming",294791,22609,163,4256,2,1
"Margot Robbie TATTOOS One of the Production Staff! | The Graham Norton Show","The Graham Norton Show",24,"Entertainment",1215597,16926,407,1260,2,1
"I put YouTubers on my nails and they all saw","Simply Nailogical",24,"Entertainment",1387283,96417,1222,10920,2,1
"J Balvin, Willy William - Mi Gente featuring Beyoncé","jbalvinVEVO",10,"Music",10736487,389230,19957,31269,2,1
"Most Powerful Corporations in the World?","The Infographics Show",27,"Education",273250,6554,418,1479,2,1
"Catalonia referendum: Voters confront police in Barcelona","Al Jazeera English",25,"News & Politics",181018,1001,167,1733,2,1
"Is Superman Too Overpowered?","VariantComics",24,"Entertainment",222336,6510,574,2837,2,1
"콜린퍼스가 직접 말해주는 신사답게 옷입는법!!?","영국남자 Korean Englishman",23,"Comedy",740491,20834,218,2024,2,1
"I Dressed Like Store Mannequins For A Week","Safiya Nygaard",22,"People & Blogs",2744830,157519,1245,11913,2,1
"Letting a Dream Die","katilette",22,"People & Blogs",1251500,71542,3096,19848,2,1
"How to Build a Teleporter with Aliens","minutephysics",28,"Science & Technology",379275,15934,605,1817,2,1
"Shameless | Season 8 Official Trailer | Only on SHOWTIME","Shameless",24,"Entertainment",482303,11897,215,1253,2,1
"WE BARE BEARS CUPCAKES - NERDY NUMMIES","Rosanna Pansino",26,"Howto & Style",409047,23639,219,7733,2,1
"MONSTER FROGFISH FOUND!","Brave Wilderness",15,"Pets & Animals",2526125,43626,1232,6597,2,1
"New Yorkers Help Us Write An Inspirational Jam! The Key of Awesome #126","The Key of Awesome",23,"Comedy",54154,2432,124,423,2,1
"Real Life: THE GAME!  (w/ Lilly Singh)","AnthonyPadilla",23,"Comedy",719639,47905,787,2186,2,1
"Shania Twain - Swingin' With My Eyes Closed","ShaniaTwainVEVO",10,"Music",780343,10736,1303,1578,2,1
"My Favorite Tech of the Month - September!","UrAvgConsumer",28,"Science & Technology",252038,9790,386,912,2,1
"Top 10 Saddest Deaths in Harry Potter (SPOILERS) (VERY SAD)","jacksfilms",23,"Comedy",817225,74530,2013,9661,2,1
"Message Impossible | Lele Pons","Lele Pons",23,"Comedy",2897731,128601,5205,6362,2,1
"The ancient city designed to track time","Vox",25,"News & Politics",339963,11853,266,1057,2,1
"Echosmith - Get Into My Car [Official Music Video]","Echosmith",10,"Music",283716,12539,545,1454,2,1
"Stephen Colbert Becomes Steven Seagal","The Late Show with Stephen Colbert",24,"Entertainment",1432660,16279,3009,3332,2,1
"Lt Gen Silveria addresses cadets about racism incident","USAFAOfficial",27,"Education",1036474,19759,761,4822,2,1
"What Happens If You Drop a Nuclear Bomb Into a Hurricane?","RealLifeLore",27,"Education",1731165,39149,2073,6557,2,1
"Sneaky toddler steals Prince Harry's popcorn","The Royal Family Channel",25,"News & Politics",14643773,54935,6244,6245,2,1
"Guess the YouTuber's Voice Challenge with LILLY SINGH AKA SUPERWOMAN!","Molly Burke",22,"People & Blogs",29349,2269,55,221,2,1
"Casually Explained: Evolution IV - Hello Universe","Casually Explained",23,"Comedy",665451,35906,655,1594,2,1
"O.J. Simpson walks out of prison after release","CNN",25,"News & Politics",34131,235,108,545,2,1
"Sam Smith - Too Good At Goodbyes (Live From Hackney Round Chapel)","SamSmithWorldVEVO",10,"Music",2318484,116997,756,5604,2,1
"Trump Lies About Taxes, Health Care Amid Cabinet Scandals: A Closer Look","Late Night with Seth Meyers",23,"Comedy",2039320,24145,3737,5019,2,1
"BFR | Earth to Earth","SpaceX",28,"Science & Technology",2390080,45519,880,7945,2,1
"I Spent $1,000 on MILK Makeup, And....","Jackie Aina",26,"Howto & Style",551196,31962,901,3901,2,1
"Pumpkin Spiced White Hot Chocolate | Episode 1197","Laura in the Kitchen",26,"Howto & Style",68650,4096,69,261,2,1
"BUG PUPPET + DRUM PADS","barnabydixon",1,"Film & Animation",41130,5151,29,510,2,1
"Would you eat an Apple like this? - Food Life Hack","DaveHax",26,"Howto & Style",367723,6206,932,911,2,1
"What's This Video About?","vlogbrothers",22,"People & Blogs",162877,9013,228,1287,2,1
"Cats Can Be A Real Pain In The Grass - Simon's Cat | STORYTIME","Simon's Cat",15,"Pets & Animals",248729,9103,183,481,2,1
"73 Questions with Helga | Vogue Parody","Liza Koshy",23,"Comedy",6153971,421517,6692,19474,2,1
"Syracuse Football: Dino Babers Post Game NC State","Syracuse Orange sports on syracuse.com",17,"Sports",2466,1,1,0,2,1
"Sam Smith - Father Figure in the Live Lounge","BBCRadio1VEVO",10,"Music",124278,3132,62,161,2,1
"Harrison Ford and Jimmy Sip Glasses of Scotch and Tell Each Other Jokes","The Tonight Show Starring Jimmy Fallon",23,"Comedy",723786,10493,365,934,2,1
"David Guetta ft Justin Bieber - 2U (Official Video)","David Guetta",10,"Music",1521496,76531,3473,4912,2,1
"Free gifts at your neighbors door...","David Carter",22,"People & Blogs",205636,452,57,108,2,1
"Bears vs. Packers | NFL Week 4 Game Highlights","NFL",17,"Sports",1110677,9310,1068,1860,2,1
"Upchurch Johnny Cash (Official Music Video)","Ryan Upchurch",24,"Entertainment",368317,12057,1291,1819,2,1
"Maroon 5 - What Lovers Do ft. SZA","Maroon5VEVO",10,"Music",5132921,209456,3985,11279,2,1
"Guardians of the Galaxy Vol. 2 | VFX Breakdown | Framestore","Framestore",1,"Film & Animation",90020,917,9,48,2,1
"Picking up my NEW Mclaren LIVE!! Take 3","Salomondrin",2,"Cars & Vehicles",239311,7924,236,744,2,1
"finding out i can never run again","CaseyNeistat",22,"People & Blogs",4341179,149235,20274,14690,2,1
"Hold the Door! | Anwar Jibawi, Inanna Sarkis, Hannah Stocking & Lele Pons","Anwar Jibawi",23,"Comedy",1986284,82241,2190,4372,2,1
"KB - DNOU","Reach Records",10,"Music",55199,2793,43,474,2,1
"Aladdin Makes No Sense","SuperCarlinBrothers",22,"People & Blogs",494218,17705,1230,3158,2,1
"How To Stop A North Korean Nuclear Missile","Real Engineering",28,"Science & Technology",353758,12580,347,1513,2,1
"dodie - 6/10","dodieVEVO",10,"Music",489193,80492,481,8374,2,1
"Introducing the Kylie Cosmetics Fall Lip Kits","Kylie Cosmetics",22,"People & Blogs",2205743,69723,6375,6956,2,1
"HURRY UP BLOOPERS!","SUPERFRUIT",24,"Entertainment",162081,11278,111,803,2,1
"Prince Harry's popcorn swiped by toddler","CBC News",25,"News & Politics",1616537,8359,346,1083,2,1
"Jeremy Camp - Never Stopped Loving","JeremyCampVEVO",10,"Music",40106,2280,23,163,2,1
"Kelly Clarkson - Move You [Nashville Sessions]","Kelly Clarkson",10,"Music",58651,3372,18,256,2,1
"What Really Happens In A Women’s Washroom (ft. Inanna Sarkis, Hannah Stocking, & Lele Pons)","IISuperwomanII",23,"Comedy",3194027,215367,3385,8980,2,1
"Wanda Sykes Confesses Everything While Eating Spicy Wings | Hot Ones","First We Feast",26,"Howto & Style",1302368,39808,2283,6041,2,1
"Jamie Foxx and Jay Pharoah Play the Impressions Game","TheEllenShow",24,"Entertainment",1139711,16968,638,617,2,1
"HANDSTAND AT 40,000Ft!! | World Championships Vlog (1)","Nile Wilson",17,"Sports",186994,7738,122,554,2,1
"Demi Lovato - Sorry Not Sorry (Vevo X Demi Lovato)","DemiLovatoVEVO",10,"Music",1022106,80554,430,2548,2,1
"Mosby's Motto","Tyler H",22,"People & Blogs",203727,3046,148,102,2,1
"Kaley Cuoco Reveals Awkward TSA Encounter","Jimmy Kimmel Live",24,"Entertainment",239849,2054,102,293,2,1
"Darius Rucker - Life's Too Short (Audio)","DariusRuckerVEVO",10,"Music",37400,1595,43,89,2,1
"Is DC Rethinking a Shared Universe After Justice League? - SJU","ScreenJunkies News",24,"Entertainment",45402,1137,142,678,2,1
"AT&T: The Company Behind the Telephone","Business Casual",27,"Education",68560,1945,42,239,2,1
"Chris Young - Hangin' On (Lyric Video)","ChrisYoungVEVO",10,"Music",52316,2275,21,97,2,1
"Channing Tatum Grooms James Corden for Magic Mike Live","The Late Late Show with James Corden",24,"Entertainment",2098986,38293,925,1140,2,1
"Alex Aiono - Does It Feel Like Falling ft. Trinidad Cardona","AlexAionoVEVO",10,"Music",183219,18427,142,1104,2,1
"How You Really Use Exercise Machines","CollegeHumor",23,"Comedy",872733,26550,790,842,2,1
"How To Learn Faster","AsapSCIENCE",28,"Science & Technology",960993,46095,485,1528,2,1
"The surprising cause of stomach ulcers - Rusha Modi","TED-Ed",27,"Education",366528,14476,214,605,2,1
"New Thor: Ragnarok International Trailer Featuring More Hela - Movie Talk","ColliderVideos",24,"Entertainment",51925,1614,77,419,2,1
"The Last Word: Hugh Hefner","The New York Times",25,"News & Politics",163364,1812,224,594,2,1
"WTF !? DO YOU EVEN KNOW ME, FT. SVEN | DESI PERKINS","Desi Perkins",26,"Howto & Style",436205,27943,337,2574,2,1
"Great Job, C U Next Tuesday! | September 27, 2017 Act 1, Part 1 | Full Frontal on TBS","Full Frontal with Samantha Bee",22,"People & Blogs",300412,3891,1713,613,2,1
"Carmelo Anthony or Dwyane Wade: Who was bigger pick-up? | First Take | ESPN","ESPN",17,"Sports",420519,3312,181,1379,2,1
"Rush Limbaugh on the Pat Sajak Show: Part 3/3","Mike Gardner",24,"Entertainment",6469,15,3,12,2,1
"P!nk - Beautiful Trauma (Audio)","PinkVEVO",10,"Music",2090385,75157,988,3020,2,1
"Kimbra - Everybody Knows (Official Lyric Video)","kimbramusic",10,"Music",24461,2564,11,337,2,1
"Annihilation (2018) - Teaser Trailer - Paramount Pictures","Paramount Pictures",1,"Film & Animation",5520472,28421,2684,3508,2,1
"The $100 14-inch Pizza Challenge (I did it twice)","Matt Stonie",24,"Entertainment",1666414,53292,1840,4716,2,1
"Woman forcibly removed off Southwest flight","CBS This Morning",25,"News & Politics",972059,3286,4460,3299,2,1
"Tara where are we?","LTavvy",23,"Comedy",235022,0,0,95,2,1
"Building a Solar Powered Workshop","HomeMadeModern",26,"Howto & Style",349266,23613,495,1176,2,1
"BØRNS - Sweet Dreams (Audio)","BØRNSmusicVEVO",10,"Music",106384,11276,40,1064,2,1
"The Floppotron: Doom E1M1 - At Doom's Gate","Paweł Zadrożniak",10,"Music",93873,7341,26,710,2,1
"Joe Goes To The Juggalo March","Joe Goes",23,"Comedy",66524,3055,108,537,2,1
"How To Make Every Popular Mexican Dish... VEGAN","Brothers Green Eats",26,"Howto & Style",28076,1262,106,230,2,1
"President Donald Trump Addresses National Association of Manufacturers (Full) | NBC News","NBC News",25,"News & Politics",14532,146,111,0,2,1
"1,000,000 THANK YOU!","Amber Scholl",26,"Howto & Style",275080,51626,248,10611,2,1
"Meet The Black Comedian Who Has Become Japan’s Most Unlikely Star (HBO)","VICE News",25,"News & Politics",81757,2528,177,636,2,1
"What Will Happen To You in The Microwave?","Meet Arnold",22,"People & Blogs",2192954,74544,2722,7834,2,1
"WILD SPACEAGE HALLOWEEN ALIEN TRANSFORMATION | John Maclean","John Maclean",26,"Howto & Style",30166,2663,44,552,2,1
"DARKEST HOUR - Official Trailer 2 [HD] - In Select Theaters November 22nd","Focus Features",24,"Entertainment",946492,184,18,34,2,1
"Steven Seagal Calls NFL Protests 'Disgusting' | Good Morning Britain","Good Morning Britain",24,"Entertainment",656690,3129,5696,0,2,1
"VIDEO: Woman dragged off Southwest Airlines flight","CBS North Carolina",25,"News & Politics",1252355,4164,1846,7422,2,1
"Little Dragon - Peace Of Mind (feat. Faith Evans) [Official Music Video]","Little Dragon",10,"Music",41287,2249,18,181,2,1
"Green Lantern - Nostalgia Critic","Channel Awesome",24,"Entertainment",827684,27898,1504,5656,2,1
"My First PC Build with Austin Evans !!!!","Sara Dietschy",1,"Film & Animation",52055,3290,65,647,2,1
"32 THINGS I'VE LEARNED THIS YEAR // Grace Helbig","Grace Helbig",22,"People & Blogs",135260,10907,49,480,2,1
"BLADE RUNNER 2049 - Black Out 2022 Anime Short","Warner Bros. Pictures",24,"Entertainment",429818,16182,172,1187,2,1
"New Dad Andy Samberg’s Epic CONAN Entrance  - CONAN on TBS","Team Coco",23,"Comedy",239430,4669,167,265,2,1
"Under $300 Bedroom Makeover | Mr. Kate Decorates on a Budget","Mr. Kate",26,"Howto & Style",1020561,49907,617,2541,2,1
"Jane Fonda Recalls The Moment She Knew Robert Redford Would Be A Star | Megyn Kelly TODAY","TODAY",25,"News & Politics",312196,204,237,187,2,1
"Samoa Hotshot crew 61.  2017","Lori Light",22,"People & Blogs",66342,468,10,31,2,1
"FLETCHER - You Should Talk (Official Audio)","FLETCHERVEVO",10,"Music",30110,3401,4,255,2,1
"Trying $3000 Lace Front Wigs With Pia Muehlenbeck!","Chloe Morello",26,"Howto & Style",193778,5611,290,530,2,1
"Hugh Hefner Dead at 91 | E! News","E! News",24,"Entertainment",119136,644,193,1247,2,1
"73 Questions With Zac Efron | Vogue","Vogue",24,"Entertainment",4397111,145752,2664,8974,2,1
"What Emmy Eats in a Week #6","emmymadeinjapan",26,"Howto & Style",93878,4032,145,409,2,1
"Gwen Stefani - Santa Baby (Audio)","GwenStefaniVEVO",10,"Music",47618,2794,63,309,2,1
"What's the Northernmost Town in the world?","Half as Interesting",27,"Education",216941,7319,248,732,2,1
"Adam Ruins Everything - Why Filing Taxes Is So Hard (Tease) | truTV","truTV",24,"Entertainment",331101,6914,185,624,2,1
"Not a baby brother!","Siobhan O'Brien",22,"People & Blogs",146392,358,90,137,2,1
"EDEN - start//end (official video)","EDEN",10,"Music",284649,26990,144,3316,2,1
"Peter Helliar in a Finnish Sauna - The Project","TheRealFake00",24,"Entertainment",127287,230,18,22,2,1
"Bea Miller - brand new eyes (From Wonder/Official Video)","BeaMillerVEVO",10,"Music",146689,18183,54,765,2,1
"Cider-Braised Pork Shoulder - Pork Stewed in a Creamy Apple Cider Sauce","Food Wishes",26,"Howto & Style",158477,5615,69,440,2,1
"Makeup Tips & Secrets With Superstar Ariel Tejada | Shay Mitchell","Shay Mitchell",26,"Howto & Style",808999,40030,729,2245,2,1
"GoPro HERO6: This Is the Moment in 4K","GoPro",17,"Sports",826192,20915,193,1229,2,1
"Kate McKinnon Improvises a PowerPoint Presentation | Vanity Fair","Vanity Fair",24,"Entertainment",120659,3379,87,201,2,1
"First Aid Kit - It's a Shame (Audio)","FirstAidKitVEVO",10,"Music",56504,2095,20,187,2,1
"Rep. Steve Scalise returns to Congress (C-SPAN)","C-SPAN",25,"News & Politics",13317,299,34,114,2,1
"'Playboy' Founder Hugh Hefner Dead at 91","Entertainment Tonight",24,"Entertainment",44540,528,45,568,2,1
"Randall Cunningham Seizes the Means of Production | Pretty Good, Episode 13","SB Nation",17,"Sports",53744,2772,76,544,2,1
"Reese Witherspoon Passionately Speaks About Roles for Women | Lorraine","Lorraine",24,"Entertainment",12877,34,1,0,2,1
"Google Ultra Pixel - New Pixel 2 Smartphone LEAKED?","Mrwhosetheboss",28,"Science & Technology",505869,9500,1084,1339,2,1
"WHAT IS THIS CHANNEL? / Gaby & Allison","Just Between Us",23,"Comedy",79144,6451,40,367,2,1
"KUWTK | Kim Kardashian Calls Caitlyn a Liar Over Her Book | E!","E! Entertainment",24,"Entertainment",1010709,5566,681,864,2,1
"IGN Live: Red Dead Redemption 2 Trailer Reveal","IGN",20,"Gaming",315637,6223,691,399,2,1
"U2 - You’re The Best Thing About Me (Official Video)","U2VEVO",10,"Music",881163,20543,874,1626,2,1
"Chemotherapy Effects Not Working!","Wil Dasovich",22,"People & Blogs",359654,14511,134,2224,2,1
"The Killing of a Sacred Deer | Playdate | Official Trailer 2 HD | A24","A24",1,"Film & Animation",134056,1373,48,146,2,1
"Laser + mirror + sound","Steve Mould",28,"Science & Technology",122440,7736,46,840,2,1
"How Quicksand Causes Dam Failures","Practical Engineering",27,"Education",191850,7653,181,379,2,1
"Blue Planet II : The Prequel","BBC Earth",15,"Pets & Animals",1280236,33381,289,2278,2,1
"Watford Richarlison Chant - Richarlison Plays For Watford In Silva's Army","Watford Fc",24,"Entertainment",31300,40,0,0,2,1
"Trader Joe's Pumpkin Spice Taste Test","Good Mythical Morning",23,"Comedy",1564867,40014,723,3846,2,1
"Hill, offense lead Dodgers' 10-0 victory: 9/27/17","MLB",17,"Sports",25871,203,12,18,2,1
"Nick Jonas Plays With Puppies (While Answering Fan Questions)","BuzzFeed Celeb",22,"People & Blogs",337021,18204,58,810,2,1
"Preview: The Most Surprising Adventure Yet | Season 1 Ep. 5 | THE ORVILLE","The Orville",24,"Entertainment",11397,264,4,74,2,1
"Ollie's Baby is BORN!! (And MARK STRONG NAMED HER!!!)","JOLLY",23,"Comedy",936084,41787,255,4821,2,1
"WHITE WALKER GAME OF THRONES  -  HALLOWEEN MAKEUP TUTORIAL","Glam&Gore",22,"People & Blogs",251705,20754,130,1098,2,1
"BANKS - Underdog (Audio)","banksVEVO",10,"Music",201346,12556,103,875,2,1
"Miley Cyrus and Zane Lowe on Beats 1 [Full Interview]","Beats 1 Radio",10,"Music",19650,692,20,69,2,1
"PRETTYMUCH - Teacher (Audio)","PrettyMuchVEVO",10,"Music",117128,13686,89,1794,2,1
"Roman Bürki's funny pre-match ritual for Borussia Dortmund ⚽😂","Borussia Dortmund",17,"Sports",580190,9237,322,391,2,1
"iPhone 8 Plus vs. Galaxy Note 8 Speed Test","PhoneBuff",28,"Science & Technology",452856,9070,953,3598,2,1
"Watch This","ULOOK2",24,"Entertainment",69349,31,4,34,2,1
"James Blunt - Don't Give Me Those Eyes [Official Video]","James Blunt",10,"Music",174633,8083,91,342,2,1
"Sean Hayes On Working With Debbie Reynolds | WWHL","Watch What Happens Live with Andy Cohen",24,"Entertainment",39712,319,3,15,2,1
"ABN AMRO launches Kaan’s Stream Store - Worlds First Livestream Store","ABN AMRO",22,"People & Blogs",80610,574,22,34,2,1
"Jacob Sartorius - Hang Me Out To Dry","Jacob Sartorius",10,"Music",214045,25578,746,3152,2,1
"Why Farming Is Broken (And Always Has Been)","MinuteEarth",28,"Science & Technology",370200,14416,836,1449,2,1
"Grateful (Official Lyric Video) - Elevation Worship","Elevation Worship",10,"Music",37229,1552,19,4,2,1
"I Spent 24 Hours in Complete Darkness & Silence and It Sent Me Crazy (No Senses Challenge)","Kill'em",24,"Entertainment",460448,16812,1467,4370,2,1
"Queen Sugar Star Kofi Siriboe!","Wendy Williams",24,"Entertainment",203718,4163,119,958,2,1
"RAPPING FOR A JOB AT VAYNERMEDIA","DKIRK",10,"Music",1224851,25127,1577,1537,2,1
"Jon Cozart Roasts Lilly Singh, Liza Koshy & Casey Neistat with a Song - Streamys 2017","Streamy Awards",24,"Entertainment",1788736,86388,1415,3922,2,1
"Reading More Fables (I swear I'm not a furry)","TheOdd1sOut",23,"Comedy",3578130,197198,2988,41119,2,1
"Luis Fonsi - Despacito (Beatbox Cover) | Hiss & Bigman | Shout out","Korea Beatbox TV",10,"Music",856071,22753,603,1537,2,1
"i'm not okay.","The Gabbie Show",26,"Howto & Style",2232484,173964,3539,15569,2,1
"Dramatic Vampy Fall Makeup Tutorial","Christen Dominique",26,"Howto & Style",251501,20853,204,1497,2,1
"HUSBAND + FATHER STRUGGLES || #MOMTEMBER","From Head To Toe",26,"Howto & Style",74711,4035,46,299,2,1
"76ers' Ben Simmons: Donald Trump is an 'idiot,' 'd***head'","NBA Highlights · YouTube",17,"Sports",21837,71,38,97,2,1
"The Ford GT drives the iconic Atlantic Ocean Road in Norway (+Arctic Circle Raceway)","Ford Europe",2,"Cars & Vehicles",50372,469,4,34,2,1
"GET UNREADY WITH ME!","AndreasChoice",26,"Howto & Style",227156,13076,263,412,2,1
"Stranger Things | Love in the Upside Down | Netflix","Netflix",24,"Entertainment",383616,12566,229,846,2,1
