"title","channel_title","category_id","category_desc","views","likes","dislikes","comment_total","day","month"
"I LET A BOY PICK MY HALLOWEEN COSTUMES | ft. Caspar Lee!","MyLifeAsEva",26,"Howto & Style",575536,35892,377,3015,12,1
"Last Week Tonight with John Oliver - Oct 8, 2017","TV Shows",22,"People & Blogs",838000,5640,1702,1517,12,1
"Hot hand fallacy","Davide Quaranta",22,"People & Blogs",149462,730,1978,867,12,1
"Intense 🎙️ ASMR 🎙️ Sounds","Gentle Whispering ASMR",26,"Howto & Style",603832,19741,833,4509,12,1
"Why I Left GMM","Good Mythical Morning",23,"Comedy",3045767,109007,33828,32002,12,1
"Google Home Mini Review: Smart Home for $49?","Marques Brownlee",28,"Science & Technology",1171245,44494,506,4133,12,1
"Arctic Foxes Destroy Filmmaker's Camera","Nature on PBS",15,"Pets & Animals",27768,170,2,17,12,1
"Watch Us Build a 7,500 Piece Lego Millennium Falcon | WIRED","WIRED",24,"Entertainment",26962,1138,35,139,12,1
"Northern Ontario Moose vs Wolf","Dan Nystedt",22,"People & Blogs",889311,3144,107,413,12,1
"TheYBF Exclusive : Amina Buddafly + Peter Gunz from WE tv's “Marriage Boot Camp Reality Stars","YBF Chic",24,"Entertainment",2645,1,0,1,12,1
"Frankie and​ ​Witney’s - Quickstep - Dancing with the Stars","Dancing With The Stars",24,"Entertainment",237533,1204,12,65,12,1
"100 People Tell Us a Secret","WatchCut Video",24,"Entertainment",655882,19411,248,2268,12,1
"UCF Football: Space Game Uniform Reveal","UCF Knights",17,"Sports",7554,33,0,3,12,1
"100 TUBES of MASCARA - Faves & Hates - MAKEUP GRAVEYARD","Tati",26,"Howto & Style",550332,24338,612,4346,12,1
"Johnny Drille - Romeo & Juliet ( Official Music Video )","MavinRecords",10,"Music",44069,1369,54,232,12,1
"MAKING RIHANNA'S CLOTHES *for cheap!*","Amber Scholl",26,"Howto & Style",417939,21513,781,2354,12,1
"Cassie On Marriage, Dealing w/ Rumors & Short Film","HOT 97",10,"Music",56099,547,48,286,12,1
"I Love You, America: The Song (Official) • I Love You, America on Hulu","Hulu",24,"Entertainment",1064760,808,3073,1717,12,1
"How to Make Pusheen Brownie Pops! 💕","kawaiisweetworld",26,"Howto & Style",47204,3942,24,416,12,1
"The ONE thing every artist NEEDS to know","ANDREW HUANG",10,"Music",95721,5874,49,831,12,1
"Mike Leach Goes Off: Expand the College Football Playoff","KREM2",22,"People & Blogs",19944,69,0,24,12,1
"Chance the rapper gets pulled over in Chicago I have Faith","AMAZING HOODFACTSUNCUT",22,"People & Blogs",176289,190,675,397,12,1
"5 Sushi Gadgets put to the Test","CrazyRussianHacker",28,"Science & Technology",1916921,43914,2399,8192,12,1
"Is DNA the future of data storage? - Leo Bear-McGuinness","TED-Ed",27,"Education",149331,8909,78,793,12,1
"A very persistent brat","RM Videos",23,"Comedy",67569,510,43,95,12,1
"$19 Brunch Vs. $113 Brunch","BuzzFeedVideo",22,"People & Blogs",4678213,110685,2294,12165,12,1
"Blindfolded Makeup Challenge | Jordyn Does Kylie's Makeup While Blindfolded","Kylie Cosmetics",22,"People & Blogs",1431411,61410,2019,2679,12,1
"NY Comic-Con Official Trailer: THE X-FILES | Season 11 | THE X-FILES","The X-Files",24,"Entertainment",863308,11185,526,1939,12,1
"Black Highlighter & Black Blush Makeup TESTED | Beauty With Mi | Refinery29","Refinery29",26,"Howto & Style",29493,434,42,52,12,1
"Here's the age you peak at everything throughout life","Tech Insider",28,"Science & Technology",194920,4732,692,678,12,1
"Kit Harington’s Epic April Fools Day Prank On Rose Leslie - The Jonathan Ross Show","The Jonathan Ross Show",24,"Entertainment",3014914,7473,196,366,12,1
"The Walking Dead Season 8: Season Premiere NYCC Sneak Peek","amc",24,"Entertainment",805805,13514,1213,3465,12,1
"KELLYANNE CONWAY ON FOX & FRIENDS 10/9/17 | FOX NEWS TODAY OCTOBER 9, 2017","Hymes Jeff",25,"News & Politics",22906,103,292,191,12,1
"S.S. CORNMUFFINS GOES FOR THE FLIGHT OF A LIFETIME","APaperPlaneADay",22,"People & Blogs",31872,0,0,43,12,1
"3 Surprising Things Matter Does Under Extreme Pressure","SciShow",27,"Education",352315,11818,174,657,12,1
"PANCAKE ART CHALLENGE WITH COLLINS KEY! Learn To Make Emojis Out Of DIY Pancake!","Wengie",26,"Howto & Style",7402878,625844,6983,165729,12,1
"How Pink Was Once A Boy Color","KnowledgeHub",27,"Education",146224,8844,213,1986,12,1
"Husband VS Best Friend | Tom Daley","Tom Daley",17,"Sports",125231,9764,59,704,12,1
"PROFESSOR MARSTON & THE WONDER WOMEN | Final Trailer","Annapurna Channel",1,"Film & Animation",567964,535,178,227,12,1
"Hailee Steinfeld, Alesso - Let Me Go (Lyric Video) ft. Florida Georgia Line, watt","HaileeSteinfeldVEVO",10,"Music",548351,42533,257,1751,12,1
"GoPro: Nate Adams - GoPro Kind of Day","GoPro",17,"Sports",99836,3743,74,199,12,1
"Pumpkin Spice PASTA?! Testing 20 Pumpkin Spice Foods! Alisha Marie","AlishaMarie",26,"Howto & Style",1366430,68159,1181,11892,12,1
"Building the Ultimate PS4 Pro","Austin Evans",28,"Science & Technology",841845,29448,1451,4269,12,1
"Nick Saban tells media they're feeding his team rat poison following Alabama's win over Texas A&M","Alabama Crimson Tide on AL.com",17,"Sports",104130,747,92,316,12,1
"EAT | Double Chocolate Zucchini Cake (Gluten and Dairy Free!)","WhatsUpMoms",24,"Entertainment",108839,3572,48,395,12,1
"Demetrious Johnson vs Ray Borg | Highlights | UFC 216","UFC ON FOX",17,"Sports",356294,2005,399,1176,12,1
"Keeping Up With the Kardashians Katch-Up S14, EP.2 | E!","E! Entertainment",24,"Entertainment",288058,1694,118,139,12,1
"Brian Lewerke's 14-Yard Touchdown vs. Michigan","Big Ten Network",17,"Sports",147522,578,344,229,12,1
"IT PENNYWISE GLAM HALLOWEEN MAKEUP TUTORIAL","James Charles",24,"Entertainment",957978,74165,10328,11478,12,1
"MNT vs. Panama: Highlights - Oct. 6, 2017","U.S. Soccer",17,"Sports",48535,562,37,289,12,1
"Why rap swept the nation","1791L",25,"News & Politics",149999,11539,737,3191,12,1
"Early THOR Reactions Are Outstanding, Zelda Movie Chances - The John Campea Show","John Campea",24,"Entertainment",29403,1240,48,808,12,1
"Stelter: Weinstein firing is an earthquake in Hollywood","CNN",25,"News & Politics",43901,330,295,1061,12,1
"GET READY WITH ME | Teacher Evolution Ep 10","Pocketful of Primary",27,"Education",32485,1404,36,498,12,1
"Eater's Top 5 Favorite Barbecue Joints In America — The Meat Show","Eater",26,"Howto & Style",43518,597,252,171,12,1
"Stray Puppy Befriends Travelers Who Find Him a Home  | The Dodo","The Dodo",15,"Pets & Animals",139700,4736,51,397,12,1
"Jacob Sartorius Gives RAW Interview","RAW",22,"People & Blogs",18750,1379,208,117,12,1
"Gov. Mike Huckabee's Full Interview with President Trump | TBN","Huckabee",25,"News & Politics",386745,0,0,0,12,1
"Goodnight Moon as read by LeVar Burton to Neil deGrasse Tyson","StarTalk Radio",28,"Science & Technology",107792,3498,56,395,12,1
"Line Rider - Mountain King","DoodleChaos",24,"Entertainment",948600,36715,169,830,12,1
"Gaming Beyond the Iron Curtain: East Germany","Super Bunnyhop",20,"Gaming",135122,9072,118,1535,12,1
"Rick and Morty Szechuan Sauce Riot in LA","Not Dan Harmon",22,"People & Blogs",293564,1311,663,2839,12,1
"Will it Steamroll? Giant Gummy Bear vs. Steamroller","Vat19",24,"Entertainment",1295505,17820,739,2888,12,1
"FENTY BEAUTY HOLIDAY COLLECTION BY RIHANNA TUTORIAL | SONJDRADELUXE","sonjdradeluxe",26,"Howto & Style",82598,6594,128,688,12,1
"UFC 216: Post-fight Press Conference","UFC - Ultimate Fighting Championship",17,"Sports",258327,2087,164,845,12,1
"Governor Brown Signs SB 17 into Law","California Senate Democrats",25,"News & Politics",755,0,0,0,12,1
"Cara Delevingne Hopes Talking About Her Mental Health Will Help Others | This Morning","This Morning",24,"Entertainment",161315,2579,121,0,12,1
"The Greatest Nancy Panel Ever Drawn","Glyph Jockey",1,"Film & Animation",28613,105,13,30,12,1
"Hurricane Nate leaves path of destruction along Gulf Coast","ABC News",25,"News & Politics",29837,203,46,174,12,1
"People Didn't Believe My Mental Illness","Boldly",22,"People & Blogs",1103102,40042,724,3450,12,1
"UF's Tom Petty tribute","Joel Hartley",23,"Comedy",43131,207,25,154,12,1
"Lin-Manuel Miranda - Almost Like Praying feat Artists for Puerto Rico [Music Video]","Atlantic Records",10,"Music",2912165,97756,3007,8001,12,1
"Prince Harry and Michael Fallon unveil MOD mental health initiative","The Royal Family Channel",25,"News & Politics",4961,151,6,19,12,1
"Pacific Rim Uprising - Official Trailer (HD)","Legendary",1,"Film & Animation",5741857,49038,6865,14773,12,1
"Happy Birthday Sonja","Lady Gaga",23,"Comedy",86709,5783,220,742,12,1
"Get a Royal Ride Through the Streets of NYC | PDA with Ben Aaron","SoulPancake",24,"Entertainment",10729,277,11,30,12,1
"The Struggles of Watching ASMR","ASMR Darling",24,"Entertainment",1306136,62466,3109,11939,12,1
"Animal Adventure Park Giraffe Cam","Animal Adventure Park",15,"Pets & Animals",35450,1834,21,12,12,1
"Nature’s Wonderland | A Mickey Mouse Cartoon | Disney Shorts","Mickey Mouse",1,"Film & Animation",856592,10075,713,1648,12,1
"MY 2017 YOUTUBE REWIND **365 DAYS OF VLOGS**","Jake Paul",22,"People & Blogs",4041272,155844,40763,41376,12,1
"2. Keaton (2007)","MIT OpenCourseWare",27,"Education",7985,78,1,3,12,1
"Chris Rock Had to Reassure Michelle Obama at the White House Party | The Graham Norton Show","The Graham Norton Show",24,"Entertainment",767861,7008,769,1059,12,1
"Eric Church - Why Not Me | October 4, 2017","Grand Ole Opry",10,"Music",6078326,36535,2939,3101,12,1
"TRAGEDI HP MELEDAK! KARYAWAN HOTEL CIPUTRA","Rista Casmiaa",22,"People & Blogs",765111,206,23,67,12,1
"TROPHY CAKE ft Lindsey Stirling and Mark! - (Dancing with the Stars) - NERDY NUMMIES","Rosanna Pansino",26,"Howto & Style",620093,26584,279,5116,12,1
"HELP ME CONTOUR | Teach Me How To Beauty Tour EP3 ft. Nicol Concilio","Simply Nailogical",24,"Entertainment",1306863,68708,798,7464,12,1
"Bu Reveals What Ended Relationship With Tracee Ellis Ross","thejasminebrand",22,"People & Blogs",33142,87,235,156,12,1
"Issa Rae & Yvonne Orji Throw The Blackest Party of 2017 - [#LemonPepperShawties]","The Film Culture Media",22,"People & Blogs",2075,6,1,0,12,1
"Canelé de Bordeaux - Crispy Baked French Custard Cakes - How to Make Canelés","Food Wishes",26,"Howto & Style",284006,8561,204,993,12,1
"Alec Benjamin - The Wolf and the Sheep (Rough)","Alec Benjamin",10,"Music",31524,4353,4,1245,12,1
"Rudy Mancuso & Poo Bear - Black & White (Official Video)","Rudy Mancuso",23,"Comedy",2548167,181332,3293,17267,12,1
"Kane Brown - Heaven","KaneBrownVEVO",10,"Music",1623878,49038,1085,1850,12,1
"Steven Malcolm - Cereal Remix [Official Music Video] Featuring Sadie Robertson","Steven Malcolm",10,"Music",113394,1290,55,328,12,1
"Nick Kroll & John Mulaney Give Teens Puberty Advice","BuzzFeed Celeb",22,"People & Blogs",213027,5103,456,496,12,1
"Invitation - Why Don't We [Official Music Video]","Why Don't We",10,"Music",1593139,119521,961,16936,12,1
"Daniel Harrison: The Man Behind the Mustache","Studio C",23,"Comedy",333732,11336,280,2371,12,1
"😜 New iOS 11 Emojis!","iJustine",22,"People & Blogs",619290,22244,2053,11169,12,1
"NF - Outcast","NFVEVO",10,"Music",1289652,59764,1042,6853,12,1
"Торпедо vs Текстильщик: футбол, который не нужен?","Томикс-ТВ online",25,"News & Politics",552670,2268,82,736,12,1
"Spider Cat - Simon's Cat (Halloween Special) | BRAND NEW B&W","Simon's Cat",15,"Pets & Animals",576907,19225,301,831,12,1
"RECREATING MY HOMECOMING LOOK (A TAG!) // Grace Helbig","Grace Helbig",22,"People & Blogs",277422,14240,138,515,12,1
"LeBron James Fearless | Intel","Intel",28,"Science & Technology",61415,194,28,38,12,1
"Jeremy Lin addresses Kenyon Martin's comments about his dreads","NBA Highlights · YouTube",17,"Sports",112628,1192,48,629,12,1
"Ok, Cam....Im only going to say this once","The Mighty EROCK",22,"People & Blogs",63832,1330,1129,0,12,1
"NEW SHADE! MILANI CONCEAL + PERFECT 2 in 1 Foundation {First Impression Review & Demo!}","thataylaa",26,"Howto & Style",259165,11704,584,2446,12,1
"PUPPIES FIRST BATHTIME!","VLOGTOWSKI",22,"People & Blogs",323280,13781,292,2024,12,1
"Kimbra - Everybody Knows (Official Music Video)","kimbramusic",10,"Music",116762,7611,79,810,12,1
"DUSK TILL DAWN - Zayn ft. Sia | Kirsten Collins, Blake Rose, KHS Cover","Kurt Hugo Schneider",24,"Entertainment",662150,47384,776,1969,12,1
"Friday Press Conference on 1 October Shooting Incident","Las Vegas Metropolitan Police",27,"Education",38624,0,0,0,12,1
"Every Cat At 3AM","Gus Johnson",23,"Comedy",1159836,41168,1411,2424,12,1
"DENY U by SUPERFRUIT","SUPERFRUIT",24,"Entertainment",301553,26242,199,3707,12,1
"Clueless Gamer: Shadow Of War With Kumail Nanjiani  - CONAN on TBS","Team Coco",23,"Comedy",1529009,37314,1099,3084,12,1
"New Orleans readies for storm surge from Hurricane Nate","CBS This Morning",25,"News & Politics",7386,56,15,69,12,1
"Did You Call My Girl!? | Anwar Jibawi","Anwar Jibawi",23,"Comedy",3181840,109643,2638,4965,12,1
"Video shows man clinging to front of moving school bus","WBAL-TV 11 Baltimore",25,"News & Politics",16977,31,1,70,12,1
"Eminem Rips Donald Trump In BET Hip Hop Awards Freestyle Cypher","BETNetworks",24,"Entertainment",24786774,780500,127204,265461,13,1
"What Americans Heard in Cuba Attacks: The Sound","Associated Press",25,"News & Politics",185798,768,483,0,13,1
"Star Wars Trash Compactor Challenge!!","Team Edge",23,"Comedy",1042303,20603,2224,7213,13,1
"Seth Gives His Fans Eminem's Trump Ultimatum","Late Night with Seth Meyers",23,"Comedy",718223,15007,4742,3274,13,1
"Why Photos of the Eiffel Tower at Night are Illegal","Half as Interesting",27,"Education",287053,10265,643,1511,13,1
"Why Are You Anxious?","AsapSCIENCE",28,"Science & Technology",261553,11975,145,1159,13,1
"Didi homers twice as Yanks advance to ALCS: 10/11/17","MLB",17,"Sports",253110,1671,198,742,13,1
"McDonald’s Rick and Morty Szechuan Sauce TASTE TEST! (Cheat Day)","ClevverTV",24,"Entertainment",434367,13029,1455,1373,13,1
"having a non-white name","ProZD",1,"Film & Animation",756795,55874,1196,5249,13,1
"DxOMark Smartphone Ratings: Explained!","Marques Brownlee",28,"Science & Technology",485033,42134,535,4337,13,1
"Kane Brown - What's Mine Is Yours","KaneBrownVEVO",10,"Music",95856,5065,75,290,13,1
"Arnold Set off to the Center of the Earth","Meet Arnold",22,"People & Blogs",1862708,72931,2024,10539,13,1
"Seth MacFarlane Calls Out Harvey Weinstein Back In 2013","Cracken News",25,"News & Politics",2607785,19116,804,3511,13,1
"Hey Ya! - Walk off the Earth (Outkast Cover)","Walk off the Earth",10,"Music",264375,22884,275,1288,13,1
"Spill Your Guts or Fill Your Guts w/ Charlie Puth, Josh Gad, Michelle Dockery & Rachel Bloom","The Late Late Show with James Corden",24,"Entertainment",886790,28399,400,2282,13,1
"Guns N' Roses Feat. PINK! - Patience (Msg, Nyc) 10.11.17 (P!NK)","markit aneight",22,"People & Blogs",161398,1768,84,216,13,1
"Box of Lies with Margot Robbie","The Tonight Show Starring Jimmy Fallon",23,"Comedy",1109607,19554,482,1040,13,1
"Stranger Things | Friday the 13th Trailer Teaser | Netflix","Netflix",24,"Entertainment",168788,9700,120,675,13,1
"American Made by Upchurch (OFFICIAL MUSIC VIDEO)","Ryan Upchurch",24,"Entertainment",165112,10228,461,1595,13,1
"Gucci Mane - Enormous feat. Ty Dolla $ign [Official Audio]","OfficialGucciMane",10,"Music",166711,8620,207,888,13,1
"Splitting Pellets with a Knife in Slow Motion - The Slow Mo Guys","The Slow Mo Guys",24,"Entertainment",1198361,42180,552,2555,13,1
"U.S.P.S Postman Delivers Mail Santa Rosa Fires Drone Video By Douglas Thron   October 10, 2017","Douglas Thron",25,"News & Politics",495553,0,0,0,13,1
"73 Questions With Daisy Ridley | Vogue","Vogue",24,"Entertainment",1634485,46174,1655,7964,13,1
"Tourist terrified by new glass walkway that cracks under weight","CGTN",25,"News & Politics",3873250,34664,6624,7501,13,1
"TOP HALLOWEEN COSTUMES of 2017 (YIAY #365)","jacksfilms",23,"Comedy",890874,51039,351,27312,13,1
"John Legend - Penthouse Floor ft. Chance the Rapper","johnlegendVEVO",10,"Music",186321,10169,338,877,13,1
"My First Job turned into a heist movie","itsAlexClark",1,"Film & Animation",280441,15475,364,4587,13,1
"Andrew Garfield Says The World Doesn't Need Movie Stars","The Late Show with Stephen Colbert",24,"Entertainment",283117,4359,198,799,13,1
"Tour Documentary - Episode 2","Camila Cabello",10,"Music",42341,11538,23,673,13,1
"The Swift Life™ – First Look","Taylor Swift",10,"Music",459875,30731,2476,3450,13,1
"The Fire Whisperer - Cyanide & Happiness Shorts","ExplosmEntertainment",23,"Comedy",931276,41515,1352,3055,13,1
"Michael Jackson - Blood On The Dance Floor X Dangerous (The White Panda Mash-Up)","michaeljacksonVEVO",10,"Music",259965,27376,335,4057,13,1
"Star Wars: The Last Jedi Trailer (Official)","Star Wars",24,"Entertainment",26208268,610220,21122,98683,13,1
"Lindsey Stirling - Mirage","Lindsey Stirling",24,"Entertainment",981403,83305,1331,5076,13,1
"Echostar 105 / SES-11 Launch Webcast","SpaceX",28,"Science & Technology",369675,8721,117,1020,13,1
"Making a Sword with THERMITE!","TheBackyardScientist",28,"Science & Technology",575851,23437,560,3392,13,1
"Adam Ruins Everything - Why Toxins Are a Myth (Tease) | truTV","truTV",24,"Entertainment",161081,2920,168,367,13,1
"Standing Up For Yourself as a Woman, But Not Too Much","CollegeHumor",23,"Comedy",261158,17223,1506,2121,13,1
"soap tips","bill wurtz",22,"People & Blogs",1329790,139481,3019,14044,13,1
"I Accidentally Became Famous In Another Country","BuzzFeedVideo",22,"People & Blogs",1064749,51783,2485,4625,13,1
"CHINESE Street Food Tour DEEP in Sichuan, CHINA - SPICY & INCREDIBLE STREET FOOD ADVENTURE!","The Food Ranger",19,"Travel & Events",366400,9443,286,2437,13,1
"KYLO REN REACTS to The Last Jedi Trailer","Auralnauts",23,"Comedy",40488,3052,31,413,13,1
"FULL FACE USING ONLY MIRANDA'S LIPSTICK!","PsychoSoprano",23,"Comedy",1180354,54389,560,5551,13,1
"Kate Hudson Is Eager to Rock a Mullet","TheEllenShow",24,"Entertainment",246394,2986,94,353,13,1
"AN INCREDIBLE MOMENT | World Championships Final Vlog","Nile Wilson",17,"Sports",174904,9648,45,441,13,1
"MAC N' CHEESE INSIDE FRIED CHICKEN - VERSUS","HellthyJunkFood",24,"Entertainment",386348,11952,378,2577,13,1
"After Show: Lea Michele Rates John Stamos’ Kiss | WWHL","Watch What Happens Live with Andy Cohen",24,"Entertainment",14568,137,10,23,13,1
"How We Lie to Ourselves","The School of Life",27,"Education",64686,3683,122,496,13,1
"GROUP HALLOWEEN COSTUME IDEAS | Walking Dead, Riverdale + more!","Tess Christine",26,"Howto & Style",148914,9494,102,574,13,1
"NYYC 2017 1A Finals 1st Place - Evan Nagao","National Yo-Yo Contest",17,"Sports",477216,4320,180,454,13,1
"Introducing Oculus Go","Oculus",20,"Gaming",234826,1694,398,701,13,1
"The Unfortunate Truth About The Civil War","Cracked",23,"Comedy",197462,10907,1488,2877,13,1
"Cavuto: Loyalty works both ways, Mr. President","Fox News",25,"News & Politics",423436,5184,1120,2549,13,1
"How to Make a Remote Hose Pipe Controller","colinfurze",2,"Cars & Vehicles",483860,16318,727,1236,13,1
"Call Me By Your Name - Clip - Dance Party","SonyPicturesClassics",24,"Entertainment",64394,969,26,129,13,1
"Jessie Ware - Alone (Official Video)","JessieWareVEVO",10,"Music",51248,4256,24,251,13,1
"Super-easy Blueberry & Yoghurt Popsicle Recipe | Cupcake Jemma","CupcakeJemma",26,"Howto & Style",23145,1548,8,79,13,1
"Matt Damon Ruins Chris Hemsworth Interview","Jimmy Kimmel Live",23,"Comedy",3159145,47379,2907,3764,13,1
"Kris Wu - Deserve ft. Travis Scott (Official Audio)","Kris Wu",10,"Music",581951,53946,698,6505,13,1
"Will I Raise a Son Like Harvey Weinstein?","Mayim Bialik",1,"Film & Animation",93700,5379,1188,1918,13,1
"How granite countertops took over American kitchens","Vox",25,"News & Politics",486103,11772,714,1678,13,1
"Asiah Collins & Crystal Smith Get Into a Shouting Match | The Platinum Life | E!","E! Entertainment",24,"Entertainment",12012,114,9,17,13,1
"Joel Embiid 2017 Preseason Debut | October 11 at Nets - 22 Pts, 7 Rebs, 3 Ast in 15 Mins!","FreeDawkins",17,"Sports",101265,908,18,523,13,1
"How to Get Your Face Through Halloween- Skincare Routine","Glam&Gore",22,"People & Blogs",228101,17322,100,1672,13,1
"Paramore: Hard Times (Green Screen Outtakes)","Paramore",10,"Music",94468,10519,88,688,13,1
"Dealing with Cancer (This is my SECRET)","Wil Dasovich",22,"People & Blogs",194148,9707,140,1836,13,1
"Spiny Lizard Catches Me!","Brave Wilderness",15,"Pets & Animals",750038,25932,257,3987,13,1
"Hundreds are missing as out-of-control California fires burn","PBS NewsHour",25,"News & Politics",7569,60,5,0,13,1
"Sam Smith - The Thrill Of It All (Album Trailer)","SamSmithWorldVEVO",10,"Music",655109,46287,223,2804,13,1
"Hazelnut Swiss Roll Recipe","SORTEDfood",26,"Howto & Style",108380,3513,70,243,13,1
"See The Devastation of California's Still-Roaring Wildfires  (HBO)","VICE News",25,"News & Politics",25934,396,17,315,13,1
"Everything You Missed In The Last Jedi Trailer","Looper",24,"Entertainment",804710,6964,554,1472,13,1
"Jump Up, Super Star! - Super Mario Odyssey Musical","Nintendo",20,"Gaming",1196387,66552,1074,13493,13,1
"Introducing Context Cards","Snapchat",10,"Music",155407,0,0,0,13,1
"Taylor Twellman says there's an 'arrogance' to the U.S. men's soccer team | SportsCenter | ESPN","ESPN",17,"Sports",54867,836,18,631,13,1
"Secrets to measuring a piece of paper - Numberphile","Numberphile",28,"Science & Technology",236767,16015,194,1166,13,1
"Arctic Foxes Destroy Filmmaker's Camera","Nature on PBS",15,"Pets & Animals",190538,333,6,25,13,1
"OFFICIAL HOUSE TOUR!!!!!!!!","Domo and Crissy",23,"Comedy",1021587,69459,1679,9208,13,1
"Megan Mullally Hijacks A Stranger’s Tinder | Vanity Fair","Vanity Fair",23,"Comedy",367922,9952,329,653,13,1
"Finding Ralphie | A CHRISTMAS STORY LIVE!","FOX",24,"Entertainment",9182,70,37,32,13,1
"Men Try False Lashes Challenge | Try This Challenge | Refinery29","Refinery29",26,"Howto & Style",5078,117,7,16,13,1
"EXTREME PUMPKIN CARVING | for National Coming Out Day","GOTDAMN ZO",24,"Entertainment",72299,7118,38,795,13,1
"The Crazy Story Of The Barefoot Bandit","BuzzFeedBlue",17,"Sports",191413,5329,452,544,13,1
"Cut for Time: The Last Fry (Gal Gadot) - SNL","Saturday Night Live",24,"Entertainment",1165873,21986,2147,1846,13,1
"My Mama Wears Timbs","Ari Fitz",26,"Howto & Style",13895,2043,12,240,13,1
"Autumn Makeup Tutorial for Straight Men","AnthonyPadilla",23,"Comedy",172377,24234,349,3267,13,1
"The Shield reunite: Raw, Oct. 9, 2017","WWE",17,"Sports",6167747,158892,3376,22076,13,1
"100 PUPPIES PRANK ON GIRLFRIEND!","Wassabi Productions",24,"Entertainment",876315,44314,1664,4449,13,1
"Demi Lovato: Simply Complicated - Official Trailer - Coming to YouTube Oct 17th","Demi Lovato",24,"Entertainment",803709,44494,681,1792,13,1
"Freedom - International Day of the Girl","The Global Goals",29,"Nonprofits & Activism",2946711,47337,28557,0,13,1
"Adam Savage Becomes an Extra in Blade Runner 2049 Short!","Tested",28,"Science & Technology",204252,7834,88,768,13,1
"Top 10 Reasons LAVA Is The Best Pixar Short","SuperCarlinBrothers",22,"People & Blogs",215229,9120,342,2122,13,1
"People are accusing this Dove ad of being racist","Business Insider",25,"News & Politics",719160,2203,6022,6923,13,1
"Bruno Mars That's What I Like Acoustic Remix | Charlie Rose","Charlie Rose",24,"Entertainment",219255,6115,74,390,13,1
"Riverdale Season 2 Q&A answering your questions! (Part 1) | Madelaine Petsch","Madelaine Petsch",22,"People & Blogs",268024,19273,42,2394,13,1
"Star Wars Theme Song Made ENTIRELY Out of Porg Sounds!!!","Volpe Music",10,"Music",97424,1899,33,316,13,1
"Turtles All the Way Down!!! A Reunion Video","vlogbrothers",22,"People & Blogs",246029,15603,217,2189,13,1
"FULL FACE USING CHEAP AMAZON MAKEUP... OMG | Casey Holmes","Casey Holmes",26,"Howto & Style",321736,12490,504,1331,13,1
"EVERY MCDONALD'S EVER","Smosh",23,"Comedy",2128629,62045,6299,7437,13,1
"Russell Wilson Goes Undercover!","Braun",17,"Sports",35477,72,1,8,13,1
"TheYBF Exclusive : Amina Buddafly + Peter Gunz from WE tv's “Marriage Boot Camp Reality Stars","YBF Chic",24,"Entertainment",12758,2,0,1,13,1
"Angry Ex-Girlfriend Gets Revenge","ViralHog",22,"People & Blogs",15642,35,10,26,13,1
"Star Wars The Last Jedi Trailer Breakdown! (Nerdist News w/ Amy Vorpahl)","Nerdist",24,"Entertainment",97372,2972,175,557,13,1
"Recreating My FIRST Makeup Tutorial! | Jackie Aina","Jackie Aina",26,"Howto & Style",443860,37337,362,4089,13,1
"TEENS READ 10 WRONG NUMBER TEXTS (REACT)","REACT",24,"Entertainment",932717,23327,1002,2553,13,1
"Interview With A 2-Year-Old | Preschool","La Guardia Cross",23,"Comedy",69193,6705,23,908,13,1
"Jake Bugg - Waiting ft. Noah Cyrus","JakeBuggVEVO",10,"Music",55208,9091,71,821,13,1
"DEMON HALLOWEEN LOOK | DESI PERKINS","Desi Perkins",26,"Howto & Style",427827,33411,325,4007,13,1
"Halloween ASMR: Spooky Sounds (feat. Mamrie Hart)","Tyler Oakley",24,"Entertainment",192861,15692,382,2441,13,1
"My EXCITING News!!","Courtelizz1",26,"Howto & Style",94839,10721,24,2187,13,1
"Coming Out?","MyHarto",26,"Howto & Style",43702,4268,22,371,13,1
"The Marvelous Mrs. Maisel - Official Trailer [HD] | Amazon Video","Amazon Video",24,"Entertainment",59180,602,31,60,13,1
"QATAR AIRWAYS A350 BUSINESS CLASS REVIEW; INCREDIBLE","CaseyNeistat",22,"People & Blogs",3155205,109934,5368,11069,13,1
"Sean Evans Learns How to Make Sushi | Sean in the Wild","First We Feast",26,"Howto & Style",444028,11880,198,1161,13,1
"DIY Giant Spider AKA Aragog AKA HARRY POTTER HALLOWEEN BIT*HES!","ThreadBanger",26,"Howto & Style",922069,65230,566,6331,13,1
"Arcus3D C1 - It moves, kinda","Arcus-3D",28,"Science & Technology",3600,15,0,2,13,1
"St. Vincent - Pills (official audio)","St. Vincent",10,"Music",191719,3730,182,559,13,1
"Perfect Party: 30","Crate and Barrel",26,"Howto & Style",35093,222,227,0,13,1
"Star Wars: The Last Jedi - Trailer Review","Jeremy Jahns",24,"Entertainment",383552,17138,416,2703,13,1
